{
  "$schema": "http://json-schema.org/draft-07/schema#",
  "title": "Claude Code Marketplace",
  "type": "object",
  "required": ["name", "version", "owner", "plugins"],
  "properties": {
    "name": { "type": "string", "minLength": 1, "maxLength": 64 },
    "version": { "type": "string", "pattern": "^\\d+\\.\\d+\\.\\d+$" },
    "owner": {
      "type": "object",
      "required": ["name"],
      "properties": {
        "name": { "type": "string" },
        "email": { "type": "string" },
        "url": { "type": "string" }
      }
    },
    "metadata": {
      "type": "object",
      "properties": {
        "description": { "type": "string" },
        "version": { "type": "string" },
        "homepage": { "type": "string" },
        "repository": { "type": "string" },
        "license": { "type": "string" }
      }
    },
    "plugins": {
      "type": "array",
      "items": {
        "type": "object",
        "required": ["name", "description", "source", "version", "category"],
        "properties": {
          "name": { "type": "string", "minLength": 1, "maxLength": 64 },
          "description": { "type": "string", "minLength": 10 },
          "source": { "type": "string" },
          "version": { "type": "string", "pattern": "^\\d+\\.\\d+\\.\\d+$" },
          "category": { "type": "string" },
          "keywords": { "type": "array", "items": { "type": "string" } },
          "author": {
            "type": "object",
            "properties": {
              "name": { "type": "string" },
              "email": { "type": "string" }
            }
          }
        }
      }
    }
  }
}
